{
  "$schema": "../schemas/validation-rules.schema.json",
  "schemaVersion": "validation-rules-v1",
  "sourceOfTruth": {
    "creatorData": "data/creator-data.json",
    "disciplineCatalog": "data/disciplinas_v5_catalogo.json",
    "domainPolicy": "data/creator-data.json#/domainCatalogModel"
  },
  "policy": {
    "defaultSeverity": "error",
    "allowedOrigins": [
      "official",
      "logical"
    ],
    "allRulesAreBlocking": true,
    "notes": "Las reglas son inflexibles: toda infracción produce error bloqueante. Los puntos de Ventajas individuales pueden reasignarse hacia o desde Dominio personal durante la creación; mientras estén asignados a Dominio se descuentan del presupuesto individual. Los puntos nativos de Dominio personal no pueden salir de Dominio ni comprar Ventajas individuales."
  },
  "effectTypes": [
    "forbidTrait",
    "forbidTraitCategory",
    "requireTrait",
    "incompatibleTraitPair",
    "skillMaximum",
    "disciplineMaximum",
    "requireDiscipline",
    "requireDomainTrait",
    "forbidDomainTrait",
    "forbidDomainTraitCategory",
    "requireDomainTraitForCategory",
    "spendingPoolRestriction",
    "advantageToDomainContribution",
    "forbidDomainToAdvantageContribution"
  ],
  "rules": [
    {
      "id": "rule_ventrue_cannot_take_farmer",
      "scope": "character",
      "origin": "official",
      "severity": "error",
      "description": "Los Ventrue no pueden adquirir el Defecto Granjero.",
      "source": {
        "kind": "advantageText",
        "traitId": "flaw_alimentacion_granjero"
      },
      "when": {
        "clanName": "Ventrue"
      },
      "effect": {
        "type": "forbidTrait",
        "catalog": "advantages",
        "traitId": "flaw_alimentacion_granjero"
      }
    },
    {
      "id": "rule_illiterate_limits_academics_and_science",
      "scope": "character",
      "origin": "official",
      "severity": "error",
      "description": "Analfabeto limita Academicismo y Ciencias a un máximo de 1 punto.",
      "source": {
        "kind": "advantageText",
        "traitId": "flaw_linguistica_analfabeto"
      },
      "when": {
        "hasTraitId": "flaw_linguistica_analfabeto"
      },
      "effect": {
        "type": "skillMaximum",
        "skills": [
          "Academicismo",
          "Ciencias"
        ],
        "maxDots": 1
      }
    },
    {
      "id": "rule_transparent_forbids_subterfuge",
      "scope": "character",
      "origin": "official",
      "severity": "error",
      "description": "Transparente impide adquirir puntos en Subterfugio.",
      "source": {
        "kind": "advantageText",
        "traitId": "flaw_aspecto_transparente"
      },
      "when": {
        "hasTraitId": "flaw_aspecto_transparente"
      },
      "effect": {
        "type": "skillMaximum",
        "skills": [
          "Subterfugio"
        ],
        "maxDots": 0
      }
    },
    {
      "id": "rule_archaic_forbids_technology",
      "scope": "character",
      "origin": "official",
      "severity": "error",
      "description": "Arcaico fija Tecnología en 0.",
      "source": {
        "kind": "advantageText",
        "traitId": "flaw_defectos_arcaicos_arcaico"
      },
      "when": {
        "hasTraitId": "flaw_defectos_arcaicos_arcaico"
      },
      "effect": {
        "type": "skillMaximum",
        "skills": [
          "Tecnología"
        ],
        "maxDots": 0
      }
    },
    {
      "id": "rule_tempered_will_forbids_domination_and_presence",
      "scope": "character",
      "origin": "official",
      "severity": "error",
      "description": "Voluntad Templada sólo puede adquirirse si el personaje no tiene Dominación ni Presencia.",
      "source": {
        "kind": "advantageText",
        "traitId": "merit_otros_voluntad_templada"
      },
      "when": {
        "hasTraitId": "merit_otros_voluntad_templada"
      },
      "effect": {
        "type": "disciplineMaximum",
        "disciplines": [
          "Dominación",
          "Presencia"
        ],
        "maxDots": 0
      }
    },
    {
      "id": "rule_bonds_of_fealty_requires_domination",
      "scope": "character",
      "origin": "official",
      "severity": "error",
      "description": "Vínculos de Lealtad requiere que el personaje posea Dominación.",
      "source": {
        "kind": "advantageText",
        "traitId": "merit_vinculos_vinculos_de_lealtad"
      },
      "when": {
        "hasTraitId": "merit_vinculos_vinculos_de_lealtad"
      },
      "effect": {
        "type": "requireDiscipline",
        "discipline": "Dominación",
        "minDots": 1
      }
    },
    {
      "id": "rule_groveling_worm_incompatible_with_penitence",
      "scope": "character",
      "origin": "official",
      "severity": "error",
      "description": "Gusano Servil no puede adquirirse junto con Penitencia.",
      "source": {
        "kind": "advantageText",
        "traitId": "flaw_psicologicos_gusano_servil"
      },
      "effect": {
        "type": "incompatibleTraitPair",
        "catalog": "advantages",
        "traitIds": [
          "flaw_psicologicos_gusano_servil",
          "merit_psicologicos_penitencia"
        ]
      }
    },
    {
      "id": "rule_favored_blood_incompatible_with_muddled_blood",
      "scope": "character",
      "origin": "official",
      "severity": "error",
      "description": "Sangre Favorecida no puede adquirirse junto con Sangre Embarrada.",
      "source": {
        "kind": "advantageText",
        "traitId": "merit_caitiff_sangre_favorecida"
      },
      "effect": {
        "type": "incompatibleTraitPair",
        "catalog": "advantages",
        "traitIds": [
          "merit_caitiff_sangre_favorecida",
          "flaw_caitiff_sangre_embarrada"
        ]
      }
    },
    {
      "id": "rule_liquidator_incompatible_with_uncle_fangs",
      "scope": "character",
      "origin": "official",
      "severity": "error",
      "description": "Liquidador no puede adquirirse junto con Tío Colmillos.",
      "source": {
        "kind": "advantageText",
        "traitId": "flaw_caitiff_liquidador"
      },
      "effect": {
        "type": "incompatibleTraitPair",
        "catalog": "advantages",
        "traitIds": [
          "flaw_caitiff_liquidador",
          "merit_caitiff_tio_colmillos"
        ]
      }
    },
    {
      "id": "rule_influencer_requires_fame_two",
      "scope": "character",
      "origin": "official",
      "severity": "error",
      "description": "Influencer requiere Fama 2 o superior.",
      "source": {
        "kind": "advantageText",
        "traitId": "merit_fama_influencer"
      },
      "when": {
        "hasTraitId": "merit_fama_influencer"
      },
      "effect": {
        "type": "requireTrait",
        "catalog": "advantages",
        "traitId": "merit_fama",
        "minDots": 2
      }
    },
    {
      "id": "rule_enduring_fame_requires_fame_three",
      "scope": "character",
      "origin": "official",
      "severity": "error",
      "description": "Fama Duradera requiere Fama 3 o superior.",
      "source": {
        "kind": "advantageText",
        "traitId": "merit_fama_fama_duradera"
      },
      "when": {
        "hasTraitId": "merit_fama_fama_duradera"
      },
      "effect": {
        "type": "requireTrait",
        "catalog": "advantages",
        "traitId": "merit_fama",
        "minDots": 3
      }
    },
    {
      "id": "rule_zeroed_requires_mask_two",
      "scope": "character",
      "origin": "official",
      "severity": "error",
      "description": "Borrado requiere Máscara 2.",
      "source": {
        "kind": "advantageText",
        "traitId": "merit_mascara_borrado"
      },
      "when": {
        "hasTraitId": "merit_mascara_borrado"
      },
      "effect": {
        "type": "requireTrait",
        "catalog": "advantages",
        "traitId": "merit_mascara",
        "minDots": 2
      }
    },
    {
      "id": "rule_cobbler_requires_mask_two",
      "scope": "character",
      "origin": "official",
      "severity": "error",
      "description": "Curtidor requiere Máscara 2.",
      "source": {
        "kind": "advantageText",
        "traitId": "merit_mascara_curtidor"
      },
      "when": {
        "hasTraitId": "merit_mascara_curtidor"
      },
      "effect": {
        "type": "requireTrait",
        "catalog": "advantages",
        "traitId": "merit_mascara",
        "minDots": 2
      }
    },
    {
      "id": "rule_secret_master_requires_mawla",
      "scope": "character",
      "origin": "official",
      "severity": "error",
      "description": "Amo Secreto requiere Mawla.",
      "source": {
        "kind": "advantageText",
        "traitId": "flaw_mawla_amo_secreto"
      },
      "when": {
        "hasTraitId": "flaw_mawla_amo_secreto"
      },
      "effect": {
        "type": "requireTrait",
        "catalog": "advantages",
        "traitId": "merit_mawla",
        "minDots": 1
      }
    },
    {
      "id": "rule_obvious_predator_blocks_herd",
      "scope": "character",
      "origin": "official",
      "severity": "error",
      "description": "Depredador Manifiesto impide mantener Rebaño.",
      "source": {
        "kind": "advantageText",
        "traitId": "flaw_rebano_depredador_manifiesto"
      },
      "when": {
        "hasTraitId": "flaw_rebano_depredador_manifiesto"
      },
      "effect": {
        "type": "forbidTrait",
        "catalog": "advantages",
        "traitId": "merit_rebano"
      }
    },
    {
      "id": "rule_haven_cell_requires_haven_two",
      "scope": "character",
      "origin": "official",
      "severity": "error",
      "description": "Celda no está disponible en Refugios de 1 punto; requiere Refugio 2.",
      "source": {
        "kind": "advantageText",
        "traitId": "merit_refugio_celda"
      },
      "when": {
        "hasTraitId": "merit_refugio_celda"
      },
      "effect": {
        "type": "requireTrait",
        "catalog": "advantages",
        "traitId": "merit_refugio",